{
  "$schema": "https://json-schema.org/draft/2020-12/schema",
  "title": "LL-AcademicSkillsHub category",
  "type": "object",
  "required": ["order","id","zh","en","icon"],
  "properties": {
    "order":{"type":"integer","minimum":1},
    "id":{"type":"string","pattern":"^[a-z0-9]+(?:-[a-z0-9]+)*$"},
    "zh":{"type":"string","minLength":1},
    "en":{"type":"string","minLength":1},
    "icon":{"type":"string","minLength":1}
  },
  "additionalProperties": false
}
