[
  {
    "order": 1,
    "id": "literature-management",
    "zh": "论文检索与文献管理",
    "en": "Literature Search & Management",
    "icon": "search"
  },
  {
    "order": 2,
    "id": "scientific-communication",
    "zh": "科学写作与学术交流",
    "en": "Scientific Writing & Communication",
    "icon": "pen"
  },
  {
    "order": 3,
    "id": "presentation-visualization",
    "zh": "学术演示与可视化",
    "en": "Academic Presentation & Visualization",
    "icon": "chart"
  },
  {
    "order": 4,
    "id": "research-methods",
    "zh": "研究方法与科学思维",
    "en": "Research Methods & Scientific Reasoning",
    "icon": "method"
  },
  {
    "order": 5,
    "id": "bioinformatics-genomics",
    "zh": "生物信息与基因组学",
    "en": "Bioinformatics & Genomics",
    "icon": "dna"
  },
  {
    "order": 6,
    "id": "cheminformatics-drug-discovery",
    "zh": "化学信息与药物发现",
    "en": "Cheminformatics & Drug Discovery",
    "icon": "flask"
  },
  {
    "order": 7,
    "id": "clinical-precision-medicine",
    "zh": "临床医学与精准医疗",
    "en": "Clinical & Precision Medicine",
    "icon": "clinical"
  },
  {
    "order": 8,
    "id": "protein-structural-biology",
    "zh": "蛋白质工程与结构生物学",
    "en": "Protein Engineering & Structural Biology",
    "icon": "protein"
  },
  {
    "order": 9,
    "id": "machine-learning-ai",
    "zh": "机器学习与人工智能",
    "en": "Machine Learning & AI",
    "icon": "ai"
  },
  {
    "order": 10,
    "id": "materials-physics",
    "zh": "材料科学与物理计算",
    "en": "Materials Science & Computational Physics",
    "icon": "atom"
  },
  {
    "order": 11,
    "id": "data-analysis-statistics",
    "zh": "数据分析与统计建模",
    "en": "Data Analysis & Statistical Modeling",
    "icon": "statistics"
  },
  {
    "order": 12,
    "id": "scientific-databases",
    "zh": "科学数据库",
    "en": "Scientific Databases",
    "icon": "database"
  },
  {
    "order": 13,
    "id": "lab-automation",
    "zh": "实验室自动化与集成",
    "en": "Laboratory Automation & Integration",
    "icon": "automation"
  },
  {
    "order": 14,
    "id": "document-data-tools",
    "zh": "文档处理与数据工具",
    "en": "Document Processing & Data Tools",
    "icon": "document"
  },
  {
    "order": 15,
    "id": "finance-economics",
    "zh": "金融与经济数据",
    "en": "Finance & Economics Data",
    "icon": "finance"
  },
  {
    "order": 16,
    "id": "geospatial-remote-sensing",
    "zh": "地理空间与遥感",
    "en": "Geospatial & Remote Sensing",
    "icon": "globe"
  },
  {
    "order": 17,
    "id": "platform-infrastructure",
    "zh": "平台与基础设施",
    "en": "Platform & Infrastructure",
    "icon": "platform"
  },
  {
    "order": 18,
    "id": "academic-core",
    "zh": "链邻学术核心能力",
    "en": "Lianlin Academic Core",
    "icon": "spark"
  }
]
